{
  "schema": "career-profile/1",
  "meta": { "created": "2026-10-10T10:00:00.000Z", "updated": "2026-10-12T10:00:00.000Z", "generated_by": "career-profiler 0.1.0", "locale": "en", "sequence": 9 },
  "identity": { "name": "Priya Natarajan", "headline": "Critical care registered nurse", "email": "priya.n@example.com", "phone": "+1 608 555 0117", "location": { "city": "Madison", "region": "WI", "country": "USA" }, "links": [], "provenance": { "source": "interview", "confirmed": true, "at": "2026-10-10T10:00:00.000Z" } },
  "targets": { "roles": ["ICU Registered Nurse", "Charge Nurse"], "industries": ["hospital"], "seniority": "senior", "locations": ["Madison, WI"], "provenance": { "source": "interview", "confirmed": true, "at": "2026-10-10T10:00:00.000Z" } },
  "summary": { "pitch": "Registered nurse with six years of adult critical care experience in a 20-bed mixed ICU, CCRN-certified, precepting new graduates since 2023.", "strengths": ["hemodynamic monitoring", "precepting", "family communication"], "provenance": { "source": "interview", "confirmed": true, "at": "2026-10-10T10:00:00.000Z" } },
  "experience": [
    { "id": "exp-01", "employer": "St. Anselm Hospital", "title": "Registered Nurse, Medical ICU", "start": "2020-08", "end": null, "location": "Milwaukee, WI", "type": "full-time", "industry": "hospital", "team_size": 34, "scope": "Night-shift staff nurse in a 20-bed medical ICU; relief charge nurse since 2024; preceptor for new graduate nurses.", "stack": ["Epic", "mechanical ventilation", "CRRT", "vasoactive infusions", "Impella"],
      "achievements": [
        { "id": "ach-01-01", "text": "Precepted 7 new graduate nurses through the 12-week ICU orientation program; all 7 completed orientation and remained on the unit at one year.", "metrics": [ { "value": 7, "label": "new graduates precepted" }, { "value": 12, "unit": "weeks", "label": "orientation length" } ], "provenance": { "source": "interview", "confirmed": true, "at": "2026-10-11T10:00:00.000Z" } },
        { "id": "ach-01-02", "text": "Led the unit's CLABSI bundle audit project as a member of the quality council, contributing to 14 months without a central line infection on the unit.", "metrics": [ { "value": 14, "unit": "months", "label": "without a CLABSI" } ], "provenance": { "source": "interview", "confirmed": true, "at": "2026-10-11T10:00:00.000Z" } },
        { "id": "ach-01-03", "text": "Manage 1:1 and 1:2 assignments of ventilated patients on CRRT and multiple vasoactive drips, including Impella support, documenting in Epic.", "metrics": [], "provenance": { "source": "interview", "confirmed": true, "at": "2026-10-11T10:00:00.000Z" } }
      ], "provenance": { "source": "interview", "confirmed": true, "at": "2026-10-10T10:30:00.000Z" } },
    { "id": "exp-02", "employer": "Dane County Medical Center", "title": "Registered Nurse, Medical-Surgical", "start": "2018-06", "end": "2020-07", "location": "Madison, WI", "type": "full-time", "industry": "hospital", "stack": ["Cerner", "telemetry"],
      "achievements": [ { "id": "ach-02-01", "text": "Cared for 5 to 6 telemetry patients per shift on a 32-bed medical-surgical unit; recognized with the 2019 DAISY award nomination for family communication.", "metrics": [ { "value": 32, "label": "unit beds" } ], "provenance": { "source": "interview", "confirmed": true, "at": "2026-10-11T10:10:00.000Z" } } ],
      "provenance": { "source": "interview", "confirmed": true, "at": "2026-10-10T10:40:00.000Z" } }
  ],
  "education": [ { "id": "edu-01", "institution": "University of Wisconsin–Madison", "degree": "BSN", "field": "Nursing", "start": "2014-09", "end": "2018-05", "provenance": { "source": "interview", "confirmed": true, "at": "2026-10-10T11:00:00.000Z" } } ],
  "certifications": [
    { "id": "cert-01", "name": "Registered Nurse license, Wisconsin", "issuer": "Wisconsin Board of Nursing", "date": "2018-06", "expires": "2027-02", "provenance": { "source": "interview", "confirmed": true, "at": "2026-10-10T11:00:00.000Z" } },
    { "id": "cert-02", "name": "CCRN", "issuer": "AACN", "date": "2022-09", "expires": "2025-09", "provenance": { "source": "interview", "confirmed": true, "at": "2026-10-10T11:00:00.000Z" } },
    { "id": "cert-03", "name": "ACLS", "issuer": "American Heart Association", "date": "2024-03", "expires": "2026-03", "provenance": { "source": "interview", "confirmed": true, "at": "2026-10-10T11:00:00.000Z" } },
    { "id": "cert-04", "name": "BLS", "issuer": "American Heart Association", "date": "2024-03", "expires": "2026-03", "provenance": { "source": "interview", "confirmed": true, "at": "2026-10-10T11:00:00.000Z" } }
  ],
  "skills": [
    { "id": "skill-critical-care", "name": "Critical Care", "category": "clinical", "level": "expert", "years": 6, "last_used": "2026", "evidence": ["ach-01-03"], "provenance": { "source": "interview", "confirmed": true, "at": "2026-10-12T10:00:00.000Z" } },
    { "id": "skill-ventilator-management", "name": "Ventilator Management", "category": "clinical", "level": "expert", "years": 6, "evidence": ["ach-01-03"], "provenance": { "source": "interview", "confirmed": true, "at": "2026-10-12T10:00:00.000Z" } },
    { "id": "skill-crrt", "name": "CRRT", "category": "clinical", "level": "advanced", "years": 4, "aliases": ["continuous renal replacement therapy"], "evidence": ["ach-01-03"], "provenance": { "source": "interview", "confirmed": true, "at": "2026-10-12T10:00:00.000Z" } },
    { "id": "skill-ehr", "name": "EHR", "category": "systems", "level": "advanced", "years": 8, "aliases": ["Epic", "Cerner"], "provenance": { "source": "interview", "confirmed": true, "at": "2026-10-12T10:00:00.000Z" } },
    { "id": "skill-medication-administration", "name": "Medication Administration", "category": "clinical", "level": "expert", "years": 8, "provenance": { "source": "interview", "confirmed": true, "at": "2026-10-12T10:00:00.000Z" } },
    { "id": "skill-patient-care", "name": "Patient Care", "category": "clinical", "level": "expert", "years": 8, "provenance": { "source": "interview", "confirmed": true, "at": "2026-10-12T10:00:00.000Z" } },
    { "id": "skill-training", "name": "Training", "category": "leadership", "level": "advanced", "years": 3, "aliases": ["precepting", "preceptor"], "evidence": ["ach-01-01"], "provenance": { "source": "interview", "confirmed": true, "at": "2026-10-12T10:00:00.000Z" } },
    { "id": "skill-communication", "name": "Communication", "category": "general", "level": "advanced", "years": 8, "evidence": ["ach-02-01"], "provenance": { "source": "interview", "confirmed": true, "at": "2026-10-12T10:00:00.000Z" } }
  ],
  "projects": [], "publications": [], "awards": [], "volunteering": [], "languages": [], "extras": [], "documents": []
}
